bugID,TextDescription,cl,pd,co,rp,OS,bs,rs,Priority,Severity
124494,(Default search): Impossible to remove selected 'Resolution: ---' as final search criterion,Infrastructure,Infrastructure,Bugzilla,All,All,CONFIRMED,,P4,Minor
124495,Crash when open document,Application,Writer,open-import,Mac,OS X 10.9,CLOSED,IRREPRODUCIBLE,P3,Normal
124496,Not all font variants available on Macs,Application,Writer,formatting,Mac,macOS 10.12,UNCONFIRMED,,P3,Normal
124497,When applying interactive crop actions the Undo comment contains '%O' statements,Code,General,ui,All,All,CLOSED,FIXED,P3,Normal
124498,Cannot change fill character in TOC,Application,Writer,formatting,Mac,OS X 10.9,CLOSED,NOT_AN_OOO_ISSUE,P3,Major
124499,Option button border/style changes to opposite of setting,Application,Writer,formatting,PC,Windows Server 2008,CLOSED,DUPLICATE,P3,Normal
124500,can not open any files,Code,General,accessibility,PC,Windows Vista,CLOSED,NOT_AN_OOO_ISSUE,P3,Normal
124502,"when insert-picture-from file, cursor jumps to the end of the document",Application,Draw,open-import,Mac,"Mac OS X, all",UNCONFIRMED,,P3,Normal
124504,Base Report Wizard Sort,Application,Base,code,All,All,CONFIRMED,,P3,Normal
124505,Can not delete blank area on document.,Application,Writer,editing,All,"Windows 8, 8.1",CLOSED,NOT_AN_OOO_ISSUE,P3,Major
124506,VDB Function Wizard: Captions for input lines truncated at the right,Application,Calc,ui,All,"Windows, all",UNCONFIRMED,,P3,Trivial
124507,Combo Box causing crash,Application,Writer,code,PC,Windows 7,CLOSED,DUPLICATE,P3,Major
124509,"MacOSX 64 crash in the scripting environment due to getenv(""PATH"") returning a null value",Code,General,scripting,All,"Mac OS X, all",CLOSED,FIXED,P3,Normal
124511,"Dead Link ""Language Spanish"" in AOO 3.4.1 Release Notes",Infrastructure,Infrastructure,Website general issues,All,All,CLOSED,FIXED,P3,Minor
124512,Caption for Data Labels input line should show that range is common for all data series,Application,Calc,ui,All,All,CONFIRMED,,P3,Minor
124513,"""Bad allocation"" when opening file, caused by reference list",Application,Writer,open-import,PC,"Windows, all",CONFIRMED,,P3,Major
124514,No way to turn off highlighting of commented text range,Application,Writer,code,All,All,CLOSED,FIXED,P3,Normal
124515,OpenOffice Calc crashes when inserting rows,Application,Calc,editing,PC,Windows 7,CLOSED,DUPLICATE,P3,Normal
124518,"Slideshow: Custom Effect ""Teeter"" additionally changes color of text and background filling",Application,Impress,viewing,PC,All,CONFIRMED,,P3,Normal
124519,(MAC) very slow focus release for controls when properties window is shown,Application,Calc,ui,Mac,"Mac OS X, all",CONFIRMED,,P3,Normal
124520,"In Standard and Advanced Filter dialog, ""Copy Results to"" must have ""new sheet"" item",Application,Calc,ui,All,All,CONFIRMED,,P3,Normal
124521,Find & replace all with references gives wrong result,Application,Calc,editing,All,All,CLOSED,DUPLICATE,P3,Normal
124522,Memory leak opening OOo 3.2 .ODF in newer releases.,Code,General,chart,All,All,CONFIRMED,,P3,Major
124523,"Testcase requires not existing feature  ""wildcards""",Unclassified,QA,www,PC,All,CLOSED,DUPLICATE,P3,Normal
124524,Non Standard Bullets (And Numbering) undo and redo is via regular bullets if caret is in text,Application,Draw,editing,All,All,CONFIRMED,,P3,Normal
124525,Undo from different slide jumps to slide one,Application,Impress,code,PC,All,CONFIRMED,,P3,Normal
124526,Cell range pasted as OLE object instead of pasting to cells,Application,Calc,editing,All,Windows 7,CONFIRMED,,P3,Normal
124527,Need session toggle on autoformat,Application,Writer,editing,All,All,CLOSED,NOT_AN_OOO_ISSUE,P3,Major
124528,Need User defined default for 'Paste Special',Application,Writer,editing,All,All,CLOSED,WONT_FIX,P3,Normal
124529,Need User Choice of Paste Default,Application,Writer,editing,All,All,CLOSED,DUPLICATE,P3,Critical
124530,Need User Choice of Paste Default,Application,Writer,editing,All,All,CLOSED,DUPLICATE,P3,Critical
124531,New Feature - locked page,Application,Writer,editing,All,All,CLOSED,NOT_AN_OOO_ISSUE,P3,Normal
124533,"Option ""Always create a backup copy"" should be activated by default",Code,General,security,All,All,CLOSED,DUPLICATE,P3,Normal
124534,Apache Purge,Application,Writer,code,All,All,CLOSED,NOT_AN_OOO_ISSUE,P1 (highest),Blocker
124535,Wrong Test description for hyperlinks in Writer TOC,Unclassified,QA,www,PC,All,CLOSED,NOT_AN_OOO_ISSUE,P3,Normal
124537,Bullet change in one paragraph is applied to all paragraphs,Application,Writer,code,PC,Linux 64-bit,CLOSED,NOT_AN_OOO_ISSUE,P3,Minor
124538,"Can't properly install dictionary ""LANGUAGE_USER_LOW_GERMAN""",Code,General,spell checking,PC,"Windows 8, 8.1",CLOSED,NOT_AN_OOO_ISSUE,P3,Minor
124539,Internal Hyperlinks lost in partial PDF export without automatically inserted blank pages,Application,Writer,save-export,All,All,CONFIRMED,,P3,Normal
124541,"Animation of ""fill color"" doesn't work for some objects",Application,Impress,ui,All,All,CONFIRMED,,P3,Normal
124542,"After export to PPT, snake wipe page transition changed to random effect",Application,Impress,save-export,All,All,UNCONFIRMED,,P3,Trivial
124543,Cannot play S Curve 2 animation effect in MSO 2010,Application,Impress,save-export,PC,All,CONFIRMED,,P3,Normal
124544,chart label names disappear (shift) on save or paste,Code,General,chart,All,All,CONFIRMED,,P3,Normal
124545,OpenOffice Excel does not recognize JRE1.7 folder,Application,Base,code,All,Windows 7,CLOSED,NOT_AN_OOO_ISSUE,P3,Normal
124546,Spellcheck does not work,Code,General,spell checking,PC,Windows 7,CLOSED,DUPLICATE,P3,Major
124547,When trying to open .docx files the dialog to choose a file filter is shown,Application,Writer,open-import,Mac,"Mac OS X, all",CLOSED,IRREPRODUCIBLE,P3,Normal
124548,Text can be displayed outside of page margins,Application,Writer,configuration,PC,Windows 7,CLOSED,NOT_AN_OOO_ISSUE,P3,Minor
124549,"Unable to create table. Pops a message ""JRE required""",Application,Base,code,PC,Windows 7,CLOSED,NOT_AN_OOO_ISSUE,P3,Normal
124550,Position lost after pasting clipboard content,Application,Writer,editing,Mac,OS X 10.9,CLOSED,DUPLICATE,P3,Normal
124551,"word completion suggestion all capitalized, word in database is mixed case",Application,Writer,editing,All,All,CONFIRMED,,P3,Normal
124552,Spell check not working,Code,General,spell checking,PC,"Windows 8, 8.1",CLOSED,IRREPRODUCIBLE,P3,Normal
124553,Highlight of table with comment and text causes crash,Application,Writer,code,PC,Linux 64-bit,CLOSED,FIXED,P3,Major
124554,"""Space below paragraph"" changed to 0 for Contents Heading when .odt saved and reopened",Application,Writer,open-import,PC,Windows 7,CLOSED,DUPLICATE,P3,Minor
124555,Some symbol shapes are not visible after insertion,Application,Impress,code,PC,Windows 7,CLOSED,FIXED,P3,Normal
124556,Broken SDK environment,Unclassified,App Dev,sdk,All,OS X 10.8,ACCEPTED,,P3,Normal
124557,Slideshow without hardware acceleration: Particular objects covered with black rectangle,Application,Impress,viewing,All,Windows 7,CONFIRMED,,P3,Normal
124558,Gallery preview view looks empty,Code,General,ui,All,All,CLOSED,FIXED,P3,Normal
124559,Fontwork Gallery empty,Code,General,ui,All,All,CLOSED,FIXED,P3,Normal
124560,Layered Button Bar' for sub-total closes before Deleting sub-totals for multiple data ranges,Application,Calc,ui,PC,Windows 7,UNCONFIRMED,,P3,Normal
124561,Not able to identify Name range information in .ods file,Application,Calc,open-import,PC,Windows 7,CLOSED,NOT_AN_OOO_ISSUE,P3,Normal
124562,Background of pictures in Help black instead of transparent,Code,General,help,All,All,CLOSED,FIXED,P3,Minor
124563,"""Not all attributes could be read"" when load a ODS document",Application,Calc,open-import,Mac,OS X 10.9,CLOSED,DUPLICATE,P2,Critical
124564,Updating TOC content will add TOC's title as one link after exporting the sample MSO doc binary file to an odt,Application,Writer,open-import,PC,All,CLOSED,DUPLICATE,P3,Normal
124565,There is no way to turn numbering off in impress,Application,Impress,ui,All,All,CLOSED,NOT_AN_OOO_ISSUE,P3,Normal
124566,general error' when insert a TOC,Application,Writer,ui,Mac,OS X 10.9,CLOSED,DUPLICATE,P3,Normal
124567,HLOOKUP may not work in some cases,Application,Calc,code,All,All,CLOSED,DUPLICATE,P3,Normal
124570,Letter/fax/agenda wizard crashes,Code,General,code,All,All,CLOSED,FIXED,P3,Trivial
124571,Installation language is not English,Application,Installation,ui,PC,"Windows 8, 8.1",CLOSED,NOT_AN_OOO_ISSUE,P3,Normal
124572,Edits blocked with wrong message: Your IP address has been automatically blocked,Infrastructure,Infrastructure,Mwiki,All,All,CLOSED,FIXED,P3,Major
124573,Office does not start when accessibility is activated.,Code,General,accessibility,All,"Windows, all",CLOSED,FIXED,P3,Normal
124574,Publipostage avec impression,Application,Writer,printing,PC,Windows 7,CLOSED,DUPLICATE,P3,Critical
124575,Paragraph style Text Flow - New page number set to 0: Does not continue page numbering.,Application,Writer,formatting,All,All,CONFIRMED,,P3,Normal
124577,Inactive Anti Aliasing causes White line tooltip artifacts when mouseover in TOC,Application,Writer,viewing,PC,All,CONFIRMED,,P3,Normal
124578,TestLink update,Infrastructure,Infrastructure,Website general issues,All,All,CLOSED,NOT_AN_OOO_ISSUE,P3,Normal
124579,"Bold' button tooltip shows wrong shortcut ""Ctrl + B"" instead of correct ""Ctrl + G""",NLC,Native-Lang,fr,All,All,CONFIRMED,,P3,Normal
124580,PageShadow sometimes shows gaps,Application,Draw,viewing,All,All,CLOSED,FIXED,P3,Normal
124581,"opening a template using ""ALWAYS_EXECUTE _NO_WARN""",Application,Calc,programming,All,All,CLOSED,IRREPRODUCIBLE,P3,Normal
124582,Slow OO 4.0.1 on window 7,Code,General,code,All,All,CLOSED,IRREPRODUCIBLE,P3,Normal
124583,"if open the sample,the cursor can be set out of mormal range.",Application,Writer,ui,All,All,CLOSED,NOT_AN_OOO_ISSUE,P3,Normal
124584,"open the sample file in AOO, group shape containing ellipse shape and table not imported correct",Application,Impress,ui,All,All,CONFIRMED,,P3,Normal
124585,"create a TOC in document, press ctrl key, and click on an item of TOC, it can not jump to the correct page.",Application,Writer,editing,All,All,CLOSED,NOT_AN_OOO_ISSUE,P3,Normal
124586,the field text changed from '890' to 'erre'',Application,Writer,open-import,All,All,CLOSED,IRREPRODUCIBLE,P3,Normal
124587,Creating Deep Nested List of Text Items -- Fails to return back up the List Items,Application,Writer,formatting,PC,"Windows, all",CLOSED,IRREPRODUCIBLE,P3,Normal
124588,Apply header and footer to one slide cannot refresh immediately,Application,Impress,ui,All,All,CONFIRMED,,P3,Trivial
124589,"Copy-Paste from Writer adds blank behind non-breaking hyphen, non-breaking space and optional hyphen",Application,Writer,editing,All,Windows 7,CONFIRMED,,P3,Normal
124590,New-Installation AOO 4.01 can´t start on iMaC,Application,Installation,update notifications,Mac,OS X 10.9,CLOSED,IRREPRODUCIBLE,P3,Normal
124591,"printing errors with ""default"" table border",Application,Writer,printing,PC,"Linux, all",CONFIRMED,,P3,Normal
124592,takes too long to open file,Application,Writer,open-import,PC,All,CONFIRMED,,P3,Minor
124593,Unify wording Dash ↔ Hyphen,Code,General,help,All,All,CONFIRMED,,P3,Minor
124594,Cannot open files from Windows,Code,General,accessibility,PC,Windows XP,CLOSED,IRREPRODUCIBLE,P3,Normal
124595,Font modifications in paragraph style dialog not applied to text,Application,Writer,formatting,Mac,OS X 10.9,CLOSED,IRREPRODUCIBLE,P3,Normal
124596,Issue in alignment of Microsoft Word files received,Application,Writer,open-import,PC,Windows XP,CLOSED,IRREPRODUCIBLE,P3,Normal
124597,MAILMERGE: Wrong record Number in Mailing,Application,Writer,printing,PC,All,CLOSED,DUPLICATE,P2,Normal
124598,OpenOffice inoperative !,Code,General,code,Mac,"Mac OS X, all",CLOSED,DUPLICATE,P3,Normal
124599,Windows 4.1.0 installer does not recognize former versions correctly,Application,Installation,code,PC,"Windows, all",CLOSED,FIXED,P3,Normal
124600,New Tab's Print Area is Empty,Application,Calc,printing,PC,All,CLOSED,NOT_AN_OOO_ISSUE,P3,Major
124601,No file name extension added in 'File - Save as' dialog,Code,General,ui,Mac,"Mac OS X, all",CLOSED,NOT_AN_OOO_ISSUE,P3,Critical
124602,"Upon reopening Open Office from a crash, it is blocked on dialogue box to reopen windows",Application,Writer,open-import,Mac,OS X 10.9,CLOSED,DUPLICATE,P3,Blocker
124603,"script is showing ""X"" or ""!""",Code,General,scripting,All,Mac OS X 10.7,UNCONFIRMED,,P3,Major
124604,Unify grey Field Shading visibility for Text-Formatting-Marks,Application,Draw,viewing,All,All,CONFIRMED,,P4,Minor
124605,Instability of large spreadsheet,Application,Calc,ui,PC,Windows 7,CLOSED,IRREPRODUCIBLE,P3,Major
124606,"Missing  ""Sheet Right-To-Left"" checkmark",Application,Calc,ui,Mac,OS X 10.9,UNCONFIRMED,,P3,Minor
124607,".odt with (Page-No) field in header/footer and comment for text range fails to open with ""Read Error. Error reading file""",Application,Writer,open-import,PC,All,CLOSED,FIXED,P3,Critical
124608,SVG export of a selected area causes the whole canvas to be exported,Application,Draw,ui,All,All,CLOSED,FIXED,P2,Normal
124609,Size of EPS export not exact,Application,Draw,ui,All,All,CONFIRMED,,P3,Normal
124610,SVG text import looses formatting,Application,Draw,ui,Mac,OS X 10.9,CONFIRMED,,P3,Normal
124611,Created locale for nds_DE (Low German/Low Saxon),NLC,Native-Lang,de,All,All,CLOSED,FIXED,P3,Minor
124612,I get this error when I open OpenOffice and I cannot turn it off without FORCE QUIT.,Application,Installation,ui,Mac,OS X 10.9,CLOSED,DUPLICATE,P3,Normal
124613,IF returning Otherwisevalue when Thenvalue expected,Application,Calc,code,PC,All,CONFIRMED,,P3,Normal
124614,Spell Check makes it appear all words spelled incorrectly and JAVA error,Application,Writer,editing,PC,Windows 7,CLOSED,DUPLICATE,P3,Major
124615,Validity Input Help will have vanished after scroll out of sight and back,Application,Calc,viewing,All,Windows 7,UNCONFIRMED,,P5 (lowest),Trivial
124616,Reopening Windows,Code,General,accessibility,Mac,OS X 10.9,CLOSED,DUPLICATE,P3,Normal
124617,PDF export of some documents crashes AOO 4.1.0 RC on Mac,Application,Writer,save-export,Mac,"Mac OS X, all",CLOSED,FIXED,P3,Normal
124618,CRASH when open particular .pptx,Application,Impress,open-import,PC,Windows 7,CLOSED,FIXED,P3,Normal
124619,Reset' button in Help wrongly called 'Back' button,Application,Calc,help,All,All,CONFIRMED,,P3,Minor
124620,Doing math useing value of NOW(),Application,Calc,programming,PC,All,CLOSED,NOT_AN_OOO_ISSUE,P3,Minor
124621,Custom size paper ignored for printing,Application,Writer,printing,PC,"Unix, all",CONFIRMED,,P3,Major
124622,BrushOnColor effect MSO compatibility issue,Application,Impress,open-import,All,All,CONFIRMED,,P3,Major
124623,Memory leak with extension's Options page,Code,General,code,All,All,CLOSED,FIXED,P3,Normal
124624,ChangeFillColor effect MSO compatibility issue,Application,Impress,open-import,All,All,CONFIRMED,,P3,Major
124625,large row numbers exceeding  .xls limit become unpredictable broken row numbers in .xls,Application,Calc,save-export,All,All,CONFIRMED,,P3,Normal
124626,"Help Text for Back/Reset button describes ""Reset"" instead of actual function ""Back""",Code,General,help,All,All,CONFIRMED,,P3,Minor
124627,Run download stats,Infrastructure,Infrastructure,Website general issues,All,All,CLOSED,FIXED_WITHOUT_CODE,P3,Normal
124628,Two files desktop integration in 4.1.0-rpm RC1 and RC2,Application,Installation,ui,PC,"Linux, all",ACCEPTED,,P3,Normal
124629,css::ui::dialogs::Wizard crashes,Code,General,code,All,All,CLOSED,FIXED,P3,Normal
124630,Create a project for AOO400 for Tatar (tt) in Pootle,Infrastructure,Infrastructure,Pootle,All,All,CLOSED,FIXED,P3,Normal
124631,Add language support for Tatar (tt),Code,Internationalization,i18npool,All,All,CLOSED,FIXED,P3,Normal
124632,Optimize PNG files on the website,Infrastructure,Infrastructure,Website general issues,All,All,CLOSED,FIXED,P3,Normal
124633,Space for displaying coordinates within statusbar too small,Application,Draw,ui,Mac,OS X 10.9,CLOSED,DUPLICATE,P3,Normal
124634,CRASH / hang when quit particular.xls,Application,Calc,ui,All,"Windows, all",CONFIRMED,,P3,Normal
124635,cut' leaves media object at it's place,Application,Writer,editing,All,All,CONFIRMED,,P3,Normal
124636,"opening xml file shows ""General input/output error.""",Application,Writer,open-import,All,All,CLOSED,FIXED,P3,Normal
124637,Cannot uninstall/update my version of Open Office,Application,Installation,update notifications,PC,"Windows, all",CLOSED,IRREPRODUCIBLE,P3,Critical
124638,Picture background crash,Application,Writer,formatting,All,All,CLOSED,FIXED,P3,Major
124639,Paste as GDI Metafile' from WIN Paintbrush pastes nothing (without error message),Code,General,ui,All,"Windows, all",CLOSED,FIXED,P3,Normal
124640,Menu Tools > Options > Language Settings > Languages changed,Code,General,help,All,All,CONFIRMED,,P3,Minor
124641,Slideshow: Custom Animation “Blast” destroys element height under particular creation circumstances,Application,Impress,viewing,All,All,CONFIRMED,,P3,Normal
124642,"minor issues in Help, About OpenOffice Readme and notice",Application,Writer,ui,All,All,RESOLVED,FIXED,P3,Minor
124643,Commrnt in footnote jumps to start of page if a second comment is inserted,Application,Writer,formatting,All,All,CONFIRMED,,P3,Minor
124644,Static date cell contents changed after save - reopen,Application,Calc,open-import,PC,Windows 7,CLOSED,IRREPRODUCIBLE,P3,Major
124645,Averages depends of the order of values,Application,Calc,code,PC,Windows XP,CLOSED,NOT_AN_OOO_ISSUE,P3,Major
124646,Global Audio Control (via Keyboard) is disabled on running Draw (and all other OO components!),Application,Draw,viewing,PC,"Windows, all",CLOSED,DUPLICATE,P3,Normal
124647,"copy new created chart on the same sheet or another sheet, formatting of y-axis get lost",Application,Calc,formatting,All,All,CONFIRMED,,P3,Normal
124651,"change ""Language"" to ""Locale"" in Format Cells, tab Numbers",Application,Calc,ui,All,All,CONFIRMED,,P3,Minor
124653,Single slide selection moves slides around or copies some,Application,Impress,ui,Mac,OS X 10.9,UNCONFIRMED,,P3,Normal
124654,locale setting should be saved with the document,Code,Internationalization,localedata,All,All,UNCONFIRMED,,P3,Normal
124655,update style icon as in http://www.openoffice.org/documentation/manuals/OOo2.x/user_guide2_draft.pdf,Application,Writer,formatting,PC,"Windows, all",CLOSED,IRREPRODUCIBLE,P3,Major
124656,unable to disable the Quickstarter (Linux),Code,General,ui,All,"Linux, all",UNCONFIRMED,,P3,Normal
124657,Build broken since revision 1586249 from trunk on Mac OS X,Code,Build Tools,dmake,Mac,OS X 10.9,CLOSED,FIXED,P1 (highest),Critical
124658,Upload PO files for Kannada (kn) to Pootle,Infrastructure,Infrastructure,Pootle,All,All,CLOSED,OBSOLETE,P3,Normal
124659,Unification required: [< Back] and [Next >] buttons,Code,General,ui,All,Windows 7,CONFIRMED,,P3,Minor
124660,PDF/A-1a export crashes on certain documents,Application,Writer,save-export,All,All,CLOSED,DUPLICATE,P3,Normal
124661,crash when loading and re-saving attached ppt file with a single customshape,Application,Impress,save-export,All,All,CLOSED,FIXED,P3,Normal
124662,"Changing ""font color dialog"" height crashes open office",Code,General,ui,PC,Windows 7,CLOSED,DUPLICATE,P3,Major
124663,Problem while opening Writer,Application,Writer,configuration,Mac,OS X 10.9,CLOSED,DUPLICATE,P3,Normal
124664,Status Bar: View Layout Icons without function,Application,Writer,ui,All,All,CLOSED,DUPLICATE,P3,Normal
124665,Wrong result mentioned  in German Calc Help for function ZÄHLENWENN,NLC,Native-Lang,de,All,All,CONFIRMED,,P3,Normal
124666,Wrong number system mentioned in German Calc Help for function BASIS (Base),NLC,Native-Lang,de,All,All,CONFIRMED,,P3,Normal
124667,CRASH when open  particular.pptx,Application,Impress,open-import,PC,Windows 7,CLOSED,FIXED,P3,Critical
124669,Chart Object unusable (Data table missing/empty) in .pptx,Application,Impress,open-import,All,All,CONFIRMED,,P3,Normal
124670,Error Message and,Application,Writer,open-import,All,All,CLOSED,IRREPRODUCIBLE,P3,Normal
124671,Writer 'Format – Paragraph - Outline & Numbering': [Back] does not change selection in Numbering List Style,Application,Writer,ui,All,All,CONFIRMED,,P3,Normal
124672,Printing selected Object or Shape with width smaller than paper sheet width will be on 2 pages if object width is bigger than sum of widths of  columns for 1 page,Application,Calc,printing,PC,All,CONFIRMED,,P3,Normal
124673,Sheet/Layer-Tab context menu additionally shows unrelated items cut-copy-paste,Code,General,ui,PC,All,CLOSED,WONT_FIX,P3,Normal
124674,Standard and Formatting toolbars disappear after full screen view,Code,General,ui,PC,All,CLOSED,FIXED,P3,Minor
124677,"Saving presentation leads to ""format error"" on new file due to doubled xml attribute",Application,Impress,save-export,PC,Linux 64-bit,CONFIRMED,,P3,Normal
124678,"Form control ""text box"" of type ""multi-line formatted"" shows text in wrong font size",Application,Draw,viewing,PC,All,CONFIRMED,,P3,Normal
124679,#ref! error: .xls file import that contains formulas,Application,Calc,open-import,All,All,CLOSED,NOT_AN_OOO_ISSUE,P3,Normal
124681,About screen - copyright symbol unclear,Code,General,legal,PC,Linux 64-bit,CLOSED,IRREPRODUCIBLE,P3,Trivial
124682,"Installation of Language Pack fails with error message ""Product has already been installed""",Application,Installation,ui,All,Windows 7,CLOSED,FIXED,P3,Blocker
124683,Autofilter Dropdown cloned by fill down,Application,Calc,editing,All,All,CONFIRMED,,P3,Minor
124684,Export to PDF only shows placeholder for  EPS,Application,Writer,save-export,All,Linux 64-bit,CONFIRMED,,P3,Normal
124685,Highlighting color only highlight one occurrence of found text,Application,Writer,formatting,Mac,OS X 10.9,CLOSED,NOT_AN_OOO_ISSUE,P3,Normal
124686,EPS contents only shown with additional tools or if preview in EPS available,Application,Writer,open-import,All,Windows 7,CLOSED,FIXED,P3,Normal
124687,Installation of 4.1.0 RC3 SDK does not update Windows 7 list of installed programs,Application,Installation,ui,All,"Windows, all",CONFIRMED,,P3,Normal
124688,Installation of 4.1.0 RC3 over previous 4.0.1 removes icon of desktop link,Application,Installation,ui,All,"Windows, all",CLOSED,OBSOLETE,P3,Normal
124689,After update from 4.0.1 WIN Files Explorer Context menu still shows AOO 4.0.1,Application,Installation,ui,PC,Windows 7,CLOSED,OBSOLETE,P3,Normal
124690,"""The last time you opened OpenOffice it unexpectedly quit..."" Screen will not close",Code,General,ui,Mac,OS X 10.9,CLOSED,DUPLICATE,P3,Normal
124691,Numbering shifts at 100.,Application,Writer,formatting,All,Windows XP,CLOSED,DUPLICATE,P3,Normal
124692,Open office 4.1.0 beta will not open when I click on it or ay files,Code,General,code,PC,"Windows 8, 8.1",CLOSED,IRREPRODUCIBLE,P3,Critical
124693,WARNING: mis-named or un-known %-variable in setup script,Code,Build Tools,code,PC,Windows 7,CONFIRMED,,P3,Normal
124694,"Caption for print range selection radio button should be ""Selection"" instead of ""Selected Cells""",Application,Calc,ui,All,All,CONFIRMED,,P3,Minor
124695,Page number in TOC does not match the pages,Application,Writer,ui,All,All,CLOSED,NOT_AN_OOO_ISSUE,P3,Normal
124696,Extensions website - show user comments newest first,Infrastructure,Infrastructure,Website general issues,All,All,CONFIRMED,,P3,Minor
124697,"Draw continues to crash when adding- editing- moving items, and some times when i first open it",Application,Draw,editing,Mac,OS X 10.9,CLOSED,IRREPRODUCIBLE,P3,Critical
124698,RFE: Sidebar Usability,Code,General,ui,All,All,CONFIRMED,,P3,Normal
124699,focus changes to Toolbar after click into table or numbering,Application,Writer,ui,PC,"Linux, all",UNCONFIRMED,,P3,Normal
124700,"Try open an .odt file. Started this week - ""Last time you opened OpenOffice, it unexpectedly quit while reopening windows. Do you want to try to reopen its window again.""",Application,Writer,configuration,Mac,OS X 10.9,CLOSED,DUPLICATE,P3,Blocker
124701,signing of documents/macros are broken on non windows platforms,Code,General,code,All,All,CLOSED,FIXED,P3,Normal
124702,Table: Selecting column or row should preserve current cursor position,Application,Writer,ui,All,All,CONFIRMED,,P3,Normal
124703,callout are misplaced.,Application,Impress,ui,All,All,CLOSED,FIXED,P3,Normal
124704,particular .xlsx  document fails to open within acceptable time (unacceptably slow),Application,Calc,open-import,All,Windows 7,CONFIRMED,,P3,Major
124705,Crash when running openoffice Depot Macros,Code,General,scripting,PC,Windows 7,CLOSED,IRREPRODUCIBLE,P3,Normal
124706,Popup menu of vertically docked toolbar covers the toolbar,Code,General,code,All,All,CLOSED,FIXED,P3,Normal
124707,Print Page area marks shrunk to last print selection,Application,Calc,viewing,All,Windows 7,UNCONFIRMED,,P3,Minor
124708,document with particular copied contents from web-page will CRASH,Application,Writer,open-import,PC,"Windows 8, 8.1",CLOSED,IRREPRODUCIBLE,P3,Blocker
124709,Slide 1 page pane artifact,Application,Draw,ui,PC,Windows 7,UNCONFIRMED,,P3,Major
124710,http://ci.apache.org/  is down,Infrastructure,Infrastructure,Website general issues,All,All,CONFIRMED,,P3,Normal
124711,"Entries in Index hide together with text entries if text entries get Font Effect property ""Hidden""",Application,Writer,formatting,All,All,UNCONFIRMED,,P3,Normal
124712,Build broken on Linux Ubuntu 14.04 (undefined reference to __cxa_atexit),Code,General,code,All,All,CLOSED,FIXED,P3,Normal
