bugID,TextDescription,cl,pd,co,rp,OS,bs,rs,Priority,Severity
127428,"XLS import: Number not recognized, treated as string in a sum",Application,Calc,open-import,All,All,UNCONFIRMED,,P5 (lowest),Normal
127429,Program crashes,Application,Calc,editing,PC,Windows 10,CLOSED,NOT_AN_OOO_ISSUE,P5 (lowest),Normal
127431,NSIS Error,Application,Installation,ui,PC,Windows 10,CLOSED,NOT_AN_OOO_ISSUE,P5 (lowest),Normal
127432,"When exporting to PDF file, produces ""Write Error""",Application,Writer,save-export,PC,Windows 10,CLOSED,IRREPRODUCIBLE,P5 (lowest),Normal
127433,packedpixeliterator.hxx : expression used as a function,Code,General,code,PC,Linux 64-bit,CONFIRMED,,P5 (lowest),Normal
127434,libucpdav1.so: undefined symbol: component_getImplementationEnvironmentExt,Code,General,ui,PC,Linux 64-bit,UNCONFIRMED,,P5 (lowest),Critical
127435,copying arabic characters from normal text editor into writer corrupts the font,Application,Writer,formatting,All,All,UNCONFIRMED,,P5 (lowest),Normal
127436,Excel file no longer saving name given properly,Application,Calc,save-export,PC,Windows 7,CLOSED,NOT_AN_OOO_ISSUE,P5 (lowest),Minor
127437,Speakers Show As Working But No Sound,Code,General,ui,PC,Windows Vista,CLOSED,NOT_AN_OOO_ISSUE,P5 (lowest),Normal
127438,auto corection does not work,Application,Writer,ui,PC,Windows 10,CLOSED,DUPLICATE,P5 (lowest),Major
127439,Hyperlinks disappear after saving the document,Application,Writer,save-export,PC,"Windows 8, 8.1",CLOSED,IRREPRODUCIBLE,P5 (lowest),Normal
127440,Run any componet fail under ARCANOAOS 5.0,Code,General,ui,All,OS/2,CLOSED,NOT_AN_OOO_ISSUE,P5 (lowest),Normal
127441,Bibliography reference formatting,Application,Writer,formatting,All,All,CLOSED,DUPLICATE,P5 (lowest),Normal
127443,Language choosing doesn.t work,Application,Impress,editing,All,All,CLOSED,NOT_AN_OOO_ISSUE,P5 (lowest),Normal
127444,Export of inline formulae to HTML puts them on separate lines,Application,Writer,save-export,All,All,UNCONFIRMED,,P5 (lowest),Normal
127452,Help Topic Pages too tiny to read,Code,General,help,PC,Windows 10,CLOSED,NOT_AN_OOO_ISSUE,P5 (lowest),Normal
127453,Alphabetical index: Allow character formatting to be applied when inserting entry,Application,Writer,editing,All,All,UNCONFIRMED,,P5 (lowest),Normal
127454,Alphabetical index: Allow each entry level to have different layouts,Application,Writer,editing,All,All,UNCONFIRMED,,P5 (lowest),Normal
127455,"Alphabetical Index: Allow ""cross-reference"" entries",Application,Writer,editing,All,All,UNCONFIRMED,,P5 (lowest),Normal
127456,Graphs deleted when using auto filter,Application,Calc,viewing,Mac,macOS 10.12,CLOSED,IRREPRODUCIBLE,P5 (lowest),Major
127457,Graphs deleted when using auto filter,Application,Calc,viewing,Mac,macOS 10.12,CLOSED,DUPLICATE,P5 (lowest),Major
127458,Spreadsheeet crashes when I tried to use spellcheck,Application,Calc,editing,PC,Windows 10,CLOSED,DUPLICATE,P5 (lowest),Normal
127459,CORREL function results seem to depend on the slope of the data,Application,Calc,programming,PC,Linux 64-bit,CLOSED,NOT_AN_OOO_ISSUE,P5 (lowest),Normal
127460,Alphabetical Index entry disables Find & Replace function,Application,Writer,editing,All,All,UNCONFIRMED,,P5 (lowest),Normal
127461,Update bundled expat to version 2.2.1,Code,Build Tools,external prerequisites,All,All,RESOLVED,FIXED,P3,Normal
127462,Formulas are not shown with result but with the formula itself,Application,Calc,editing,PC,Windows 10,CLOSED,DUPLICATE,P5 (lowest),Normal
127463,Formulas are not shown with result but with the formula itself,Application,Calc,editing,PC,Windows 10,CLOSED,DUPLICATE,P5 (lowest),Normal
127464,The file '<file name>' could not be repaired and therefore can not be opened,Application,Calc,open-import,PC,Linux 64-bit,CLOSED,NOT_AN_OOO_ISSUE,P5 (lowest),Critical
127465,UNION & UNION ALL queries fail to produce visible results in BASE query design window.,Application,Base,code,PC,Windows 10,UNCONFIRMED,,P5 (lowest),Normal
127466,OpenOffice: HEIF & HEVC files not displayed correctly,Code,General,ui,Mac,All,UNCONFIRMED,,P5 (lowest),Normal
127467,Inserted images automatically are sized to the width of the page,Application,Writer,formatting,All,All,CLOSED,NOT_AN_OOO_ISSUE,P5 (lowest),Normal
127468,"After removing Print range, page break lines don't dissappear until reload",Application,Calc,printing,All,All,CONFIRMED,,P5 (lowest),Normal
127469,File does not open properly,Application,Writer,open-import,All,All,CLOSED,NOT_AN_OOO_ISSUE,P5 (lowest),Normal
127470,OpenOffice Calc (Not Responding),Application,Calc,editing,All,All,CLOSED,NOT_AN_OOO_ISSUE,P5 (lowest),Normal
127471,"ods file statys ""Recovery failed"", but file seems to open",Application,Calc,open-import,PC,Linux 64-bit,CLOSED,NOT_AN_OOO_ISSUE,P5 (lowest),Normal
127472,alt+num.pad codes,Code,General,ui,All,All,CLOSED,DUPLICATE,P5 (lowest),Normal
127473,freeze,Code,General,ui,All,All,CLOSED,NOT_AN_OOO_ISSUE,P5 (lowest),Normal
127474,Anchor to Page doesn't permanently save,Application,Writer,formatting,Mac,macOS 10.12,CLOSED,DUPLICATE,P5 (lowest),Normal
127475,Help Crash,Application,Calc,help,PC,Windows 10,CLOSED,NOT_AN_OOO_ISSUE,P5 (lowest),Normal
127476,Hyperlink Toolbar button fails to open dialogue,Code,General,ui,All,All,CLOSED,NOT_AN_OOO_ISSUE,P5 (lowest),Normal
127477,Zero is not Zero,Application,Calc,code,PC,Windows 10,CLOSED,NOT_AN_OOO_ISSUE,P5 (lowest),Normal
127478,Write->Format->Picture->Macro->'JRE Required' hangs program,Application,Writer,formatting,PC,Windows 7,CLOSED,DUPLICATE,P5 (lowest),Normal
127479,MATCH function error when sheets are re-ordered and indirect addressing is used,Application,Calc,programming,PC,All,UNCONFIRMED,,P5 (lowest),Normal
127481,Cannot open any writer files,Application,Writer,open-import,All,All,CLOSED,NOT_AN_OOO_ISSUE,P5 (lowest),Normal
127482,"""Please exit open"" office stops download",Application,Installation,ui,PC,Windows 10,CLOSED,NOT_AN_OOO_ISSUE,P5 (lowest),Normal
127483,"calc help missing for functions: AVERAGEIF, AVERAGEIFS, COUNTIFS, SUMIFS, and XOR. There may be others.",Application,Calc,help,All,All,CLOSED,DUPLICATE,P5 (lowest),Normal
127484,Update bundled expat to version 2.2.3,Code,Build Tools,external prerequisites,All,All,CLOSED,FIXED,P5 (lowest),Normal
127485,Missing strings in Windows installer for ca_XR and ca_XV,Application,Installation,ui,PC,"Windows, all",RESOLVED,FIXED,P5 (lowest),Minor
127486,Very Small Page,Application,Writer,formatting,All,All,CLOSED,NOT_AN_OOO_ISSUE,P5 (lowest),Normal
127487,"after saving file in ods format, tried to re-open, will not re-open",Application,Calc,open-import,PC,Windows 10,CLOSED,NOT_AN_OOO_ISSUE,P5 (lowest),Critical
127488,Endnotes go beyond bottom margin instead of onto a new page. No new page created to fit excess endnotes.,Application,Writer,editing,All,All,CLOSED,NOT_AN_OOO_ISSUE,P5 (lowest),Normal
127489,"conditional formatting multiple cells, formula format only executes on first cell",Application,Calc,formatting,All,All,UNCONFIRMED,,P5 (lowest),Normal
127490,I/O error when accessing network files in fedora 26,Code,General,accessibility,PC,Linux 64-bit,UNCONFIRMED,,P5 (lowest),Major
127491,Norwegian installer for Windows not localized,Application,Installation,ui,All,"Windows, all",RESOLVED,FIXED,P5 (lowest),Normal
127492,"OO crashes when accessing, deleting a table",Application,Calc,editing,PC,"Windows 8, 8.1",CLOSED,NOT_AN_OOO_ISSUE,P5 (lowest),Normal
127493,Add a detective toolbar to the core,Application,Calc,ui,PC,Windows 10,CLOSED,NOT_AN_OOO_ISSUE,P5 (lowest),Normal
127494,can not print from database of open office,Application,Base,code,All,"Windows, all",CLOSED,NOT_AN_OOO_ISSUE,P5 (lowest),Normal
127495,Basque and Galician installer for Windows not localized,Application,Installation,ui,All,"Windows, all",RESOLVED,FIXED,P5 (lowest),Normal
127496,This xlsx file will not open in Open Office,Application,Calc,open-import,All,All,CLOSED,DUPLICATE,P5 (lowest),Normal
127497,"""ASCII Filter Options"" dialog box opens whenever trying to save a document in PDF",Code,General,accessibility,PC,Windows 10,CLOSED,IRREPRODUCIBLE,P5 (lowest),Normal
127498,cannot print to hp 8740 from database reporter but can print from writer,Application,Base,code,All,All,CLOSED,DUPLICATE,P5 (lowest),Normal
127499,Semi colon character in ODS causes malformed CSV,Application,Calc,save-export,Mac,OS X 10.11,CLOSED,NOT_AN_OOO_ISSUE,P5 (lowest),Normal
127500,unable to delete dictionary,Application,Writer,configuration,PC,Windows 7,CLOSED,NOT_AN_OOO_ISSUE,P5 (lowest),Normal
127501,downloads file size varies,Code,General,code,PC,Windows 7,CLOSED,NOT_AN_OOO_ISSUE,P5 (lowest),Normal
127502,Icons disappeared overnight,Code,General,ui,PC,Windows 7,CLOSED,NOT_AN_OOO_ISSUE,P5 (lowest),Major
127503,sadasdasadasdas,Code,General,code,All,All,CLOSED,NOT_AN_OOO_ISSUE,P5 (lowest),Normal
127504,a,Code,General,code,All,All,CLOSED,NOT_AN_OOO_ISSUE,P5 (lowest),Normal
127505,hut RI,Code,General,code,All,All,CLOSED,NOT_AN_OOO_ISSUE,P5 (lowest),Normal
127506,hh,Code,General,code,All,All,CLOSED,NOT_AN_OOO_ISSUE,P5 (lowest),Normal
127507,jmll,Code,General,code,All,All,CLOSED,NOT_AN_OOO_ISSUE,P5 (lowest),Normal
127508,Opengrok Source Code,Unclassified,App Dev,scripting,All,All,CLOSED,NOT_AN_OOO_ISSUE,P5 (lowest),Normal
127509,Sheet protection will not hide formula,Application,Calc,editing,PC,Windows 10,CLOSED,NOT_AN_OOO_ISSUE,P5 (lowest),Normal
127510,RTF files keep corrupting on save,Application,Writer,save-export,All,Windows 10,UNCONFIRMED,,P5 (lowest),Normal
127511,Apache OpenOffice Program Crashing,Code,General,ui,PC,Windows 10,CLOSED,OBSOLETE,P5 (lowest),Normal
127512,"textable: cell value is set to ""0"" on save if cell format does not match written cell value",Application,Writer,save-export,All,"Windows, all",CONFIRMED,,P5 (lowest),Normal
127513,Increase Linux baseline to CentOS 6,Code,Build Tools,code,All,All,CLOSED,OBSOLETE,P3,Normal
127514,Test document,Application,Impress,viewing,PC,Linux 32-bit,UNCONFIRMED,,P5 (lowest),Normal
127515,Note box changes position after saving,Application,Calc,ui,PC,Windows 10,CLOSED,OBSOLETE,P5 (lowest),Normal
127516,Cannot open or save files,Application,Writer,save-export,All,"Windows 8, 8.1",CLOSED,NOT_AN_OOO_ISSUE,P5 (lowest),Normal
127517,PPTX files don't open properly in 4.1.3,Application,Impress,open-import,All,All,CLOSED,DUPLICATE,P5 (lowest),Normal
127518,"No real summary, please ignore",Code,General,ui,All,All,CLOSED,NOT_AN_OOO_ISSUE,P5 (lowest),Normal
127519,"No real summary, please ignore",Code,General,ui,All,All,CLOSED,NOT_AN_OOO_ISSUE,P5 (lowest),Normal
127520,Extension Manager's window frozen,Code,General,ui,Mac,Mac OS X 10.7,CONFIRMED,,P5 (lowest),Normal
127521,sum,Application,Calc,formatting,PC,"Windows 8, 8.1",CLOSED,NOT_AN_OOO_ISSUE,P5 (lowest),Normal
127522,request for hyphenation documentation,Application,Writer,help,All,All,CLOSED,NOT_AN_OOO_ISSUE,P5 (lowest),Normal
127523,my own files on opening locked by unknown user,Code,General,ui,PC,Windows 10,CLOSED,NOT_AN_OOO_ISSUE,P5 (lowest),Normal
127525,Background colours of table cells change when saving as MS Word file,Application,Writer,save-export,Mac,OS X 10.10,CONFIRMED,,P5 (lowest),Normal
127526,crash occurs after merging cells,Application,Writer,editing,PC,Linux 64-bit,CLOSED,NOT_AN_OOO_ISSUE,P5 (lowest),Normal
127527,Database Form Overlay Boxes Preventing The User from Filling Out the Form,Application,Base,code,PC,Windows 10,CLOSED,IRREPRODUCIBLE,P5 (lowest),Normal
127528,Calc crashes when trying to save a new file,Application,Calc,save-export,Other,Windows 10,CLOSED,FIXED_WITHOUT_CODE,P5 (lowest),Normal
127529,bullets size does not scale to the font size,Application,Writer,formatting,PC,Windows 7,CLOSED,IRREPRODUCIBLE,P5 (lowest),Normal
127530,New policy: Sign releases with SHA-512 and no longer offer MD5,Code,Build Tools,code,All,All,CLOSED,FIXED_WITHOUT_CODE,P5 (lowest),Normal
127531,"I type the word ""in"" and it types the word ""Sun""",Application,Writer,editing,PC,Windows 7,CLOSED,NOT_AN_OOO_ISSUE,P5 (lowest),Normal
127532,Can select protected cells when option is set not to.,Application,Calc,formatting,PC,All,CLOSED,DUPLICATE,P5 (lowest),Normal
127533,cannot change box only text,Application,Calc,formatting,All,All,CLOSED,IRREPRODUCIBLE,P5 (lowest),Normal
127534,Compound primary keys of type TEXT with ODBC sqlite database result in those columns always appearing empty,Application,Base,code,All,Windows 10,CLOSED,IRREPRODUCIBLE,P5 (lowest),Normal
127535,Java has disappeared,Application,Base,help,PC,Windows 7,CLOSED,FIXED,P5 (lowest),Critical
127536,GUI Hangs,Application,Calc,ui,PC,Windows 10,CLOSED,NOT_AN_OOO_ISSUE,P5 (lowest),Normal
127537,Lost all data in a file after crash and restart,Application,Calc,open-import,PC,Windows 10,CLOSED,NOT_AN_OOO_ISSUE,P5 (lowest),Critical
127538,"SV translation: ""Basic"" mistranslated as ""grundläggande""",NLC,Native-Lang,sv,All,All,CLOSED,FIXED,P5 (lowest),Normal
127539,"""split to coumns"" also changes numerical data to dates",Application,Calc,editing,All,All,CLOSED,NOT_AN_OOO_ISSUE,P5 (lowest),Normal
127540,starting AOO with symlink to <$inst_dir>/program/soffice isn't possible,Application,Installation,code,PC,"Linux, all",CONFIRMED,,P5 (lowest),Normal
127541,Trouble with reloading a previously created document,Application,Writer,open-import,All,All,CLOSED,IRREPRODUCIBLE,P5 (lowest),Normal
127542,OpenOffice Writer document OnSaveAs event calling plugin popup,Unclassified,App Dev,api,All,"Windows, all",CLOSED,NOT_AN_OOO_ISSUE,P5 (lowest),Normal
127543,Corrupted maven-metadata.xml on maven central for org.openoffice artifacts breaks version range resolution,Unclassified,App Dev,api,All,All,UNCONFIRMED,,P5 (lowest),Normal
127544,"Remove extra files from source package (clog, config.out)",Code,Build Tools,code,All,All,CONFIRMED,,P5 (lowest),Normal
127545,modo bozza on/off,Application,Calc,editing,All,Windows 10,CLOSED,NOT_AN_OOO_ISSUE,P5 (lowest),Normal
127546,Scanned Images Not Appearing in Document,Code,General,accessibility,PC,Windows 7,CLOSED,NOT_AN_OOO_ISSUE,P5 (lowest),Normal
127547,Ctrl+A does not work,Application,Writer,editing,PC,Windows 10,CLOSED,IRREPRODUCIBLE,P5 (lowest),Major
127548,"Com.Sun.Star.Style.ParagraphStyle setting paratabstops changes the value, but not visible in program.",Application,Writer,code,All,All,CLOSED,NOT_AN_OOO_ISSUE,P5 (lowest),Normal
127549,Program Hangs when timed AutoSave interrupts cut-and-paste process,Application,Calc,editing,Mac,macOS 10.12,CLOSED,IRREPRODUCIBLE,P5 (lowest),Normal
127550,Pivot table needs option to show missing values as 0 (zero),Application,Calc,formatting,All,All,CLOSED,DUPLICATE,P5 (lowest),Normal
127551,Regression in Polish dictionary,NLC,Native-Lang,pl,All,All,RESOLVED,FIXED,P5 (lowest),Normal
127552,Update metadata for OpenOffice 4.1.5 release,Code,General,code,All,All,RESOLVED,FIXED,P5 (lowest),Normal
127553,Update links doesn't work for sections in 4.1.4-RC4,Application,Writer,ui,All,All,CLOSED,FIXED,P5 (lowest),Normal
127554,Secue file,Application,Writer,editing,All,All,CLOSED,NOT_AN_OOO_ISSUE,P5 (lowest),Normal
127555,Cell grouping no longer works - cells hidden instead,Application,Calc,editing,Mac,macOS 10.12,CLOSED,IRREPRODUCIBLE,P5 (lowest),Normal
127556,Add hint to remember to download always from the original source,Code,General,ui,All,All,CONFIRMED,,P5 (lowest),Normal
127558,General Error while opening an existing .odt file in 4.1.4-RC5 on MacOS X,Code,Build Tools,code,All,"Mac OS X, all",CLOSED,FIXED,P2,Critical
127559,.xlsb and .xlsm not supported by open office,Application,Calc,open-import,PC,Windows 10,CLOSED,IRREPRODUCIBLE,P5 (lowest),Normal
127560,Draw crashes upon opening,Application,Draw,installation,Mac,macOS 10.12,CLOSED,NOT_AN_OOO_ISSUE,P5 (lowest),Critical
127561,[MacOS] Application becomes unresponsive when long text (over 65535 chars) is entered in any text field,Code,General,ui,Mac,macOS 10.13,UNCONFIRMED,,P5 (lowest),Normal
127563,Constant request to update links when opening a calc file,Application,Calc,open-import,PC,Windows 10,CLOSED,NOT_AN_OOO_ISSUE,P5 (lowest),Normal
127564,Font size in Toolbar different from actual values for Title and Description when Page Height is set to very small value,Application,Impress,ui,All,Windows 10,UNCONFIRMED,,P5 (lowest),Trivial
127565,Font sizes are modified accordingly to the Page Height only if the default font size was used,Application,Impress,ui,All,Windows 10,CLOSED,DUPLICATE,P5 (lowest),Normal
127566,Changing paragraph styles does not change font associated with that style.,Application,Writer,formatting,PC,Linux 64-bit,CLOSED,DUPLICATE,P5 (lowest),Major
127567,Print Page range To - From upper boundary validations are done in two visible steps instead of one,Code,General,ui,Mac,All,UNCONFIRMED,,P5 (lowest),Minor
127568,Diagrams become corrupt (not retrievable) when Calc document is saved,Application,Calc,save-export,Mac,macOS 10.13,RESOLVED,FIXED,P5 (lowest),Blocker
127569,Support for Boost TR1 library should be removed for Boost >= 1.65.0,Code,General,ui,All,All,UNCONFIRMED,,P5 (lowest),Normal
127570,Can't fill data into base forms,Application,Base,code,PC,Linux 64-bit,CONFIRMED,,P2,Major
127572,Crash when data plus a thin line is copied from Help topic,Code,General,help,PC,All,CONFIRMED,,P5 (lowest),Normal
127573,Cannot open any files NOR uninstall to start over,Code,General,ui,PC,Windows 10,CLOSED,NOT_AN_OOO_ISSUE,P5 (lowest),Normal
127574,Out of date OSX version,Infrastructure,Infrastructure,Website general issues,All,All,CLOSED,FIXED_WITHOUT_CODE,P5 (lowest),Normal
127575,Update check does not detect 4.1.4,Application,Installation,update notifications,All,All,CLOSED,NOT_AN_OOO_ISSUE,P5 (lowest),Normal
127576,Please delete old releases from mirroring system,Infrastructure,Infrastructure,Website general issues,All,All,CLOSED,FIXED_WITHOUT_CODE,P5 (lowest),Normal
127577,can't open any file,Code,General,accessibility,PC,Windows 10,CLOSED,NOT_AN_OOO_ISSUE,P5 (lowest),Critical
127579,PrintOrientation on star basic macro does not work,Unclassified,App Dev,vba,PC,Linux 64-bit,CLOSED,IRREPRODUCIBLE,P5 (lowest),Normal
127580,Fix for Issue 127568 created a new bug in Base,Application,Base,code,Mac,macOS 10.13,CLOSED,FIXED,P5 (lowest),Major
127581,Writer crashes after copying all content,Application,Writer,editing,PC,Windows 10,CLOSED,FIXED,P5 (lowest),Critical
127582,"Needless to have ""Update links"" dialog prompt",Application,Calc,editing,All,All,CONFIRMED,,P5 (lowest),Normal
127583,The input text fields are not editable,Code,General,ui,PC,"Linux, all",CLOSED,IRREPRODUCIBLE,P5 (lowest),Normal
127584,Special characters and underlining,Application,Writer,formatting,PC,Windows 10,CONFIRMED,,P5 (lowest),Normal
127585,Cannot complete a project(S) because of continual program shut down,Code,General,ui,PC,Windows 7,CLOSED,NOT_AN_OOO_ISSUE,P5 (lowest),Major
127587,Writer crash when copying highlighted text / graphic / text.,Application,Writer,editing,PC,Windows 10,CLOSED,NOT_AN_OOO_ISSUE,P5 (lowest),Normal
127588,Windows builds: Add OS name and version in About dialog,Code,General,ui,PC,"Windows, all",CONFIRMED,,P5 (lowest),Normal
127589,"Wrong path suggested at ""save as"" when original path contains non-ASCII characters",Code,General,ui,All,"Windows, all",UNCONFIRMED,,P5 (lowest),Normal
127590,Handles disappear from Draw object when it is moved right on page,Application,Writer,ui,PC,Windows 7,CLOSED,IRREPRODUCIBLE,P5 (lowest),Normal
127591,Record multiplication scrolling a large Base table,Application,Base,code,PC,All,REOPENED,,P5 (lowest),Major
127592,Table in docx loses column when saved as odt even though data in column appears in odt content.xml,Application,Writer,save-export,PC,Windows 7,CONFIRMED,,P5 (lowest),Normal
127593,установка,Application,Installation,ui,PC,Windows 10,CLOSED,NOT_AN_OOO_ISSUE,P5 (lowest),Normal
127594,Copy or cut forces closure,Application,Writer,editing,PC,Windows 10,CLOSED,IRREPRODUCIBLE,P5 (lowest),Normal
127595,cannot open msword 9 documents. sometimes changes to spreadsheet.,Application,Writer,open-import,PC,Windows 7,CLOSED,NOT_AN_OOO_ISSUE,P5 (lowest),Normal
127596,Calc with DDE don't close and prevent windows 10 copy/paste,Application,Calc,ui,PC,Windows 10,CLOSED,NOT_AN_OOO_ISSUE,P5 (lowest),Normal
127597,Save with password fails,Application,Writer,save-export,PC,Linux 32-bit,CLOSED,IRREPRODUCIBLE,P5 (lowest),Normal
127598,WINGDING font,Application,Calc,viewing,All,"Windows, all",CLOSED,NOT_AN_OOO_ISSUE,P5 (lowest),Normal
127599,spell chec,Application,Writer,viewing,PC,Windows 10,CLOSED,DUPLICATE,P5 (lowest),Normal
127600,AOO 4.1.4 : Creating labels on more than One page freezes application,Application,Writer,viewing,Mac,macOS 10.13,CLOSED,FIXED,P5 (lowest),Normal
127601,DDE Fields,Application,Writer,configuration,PC,Windows 10,CLOSED,IRREPRODUCIBLE,P5 (lowest),Normal
127602,sumif does not ork across workbooks,Application,Calc,editing,All,"Windows, all",CLOSED,IRREPRODUCIBLE,P5 (lowest),Normal
127603,Thesaurus is not working after update,Application,Writer,editing,PC,Windows 10,CLOSED,DUPLICATE,P5 (lowest),Normal
127604,Basic command thiscomponent.currentselection(0).name returns wrong name of grouped Draw objects,Unclassified,App Dev,scripting,Other,"Linux, all",UNCONFIRMED,,P5 (lowest),Normal
127605,While loading oo414 changes focus back to itself several times,Application,Calc,open-import,All,"Windows, all",CLOSED,IRREPRODUCIBLE,P5 (lowest),Normal
127606,update links prompt not configurable,Application,Calc,open-import,All,All,CLOSED,DUPLICATE,P5 (lowest),Normal
127607,XLS syntax formula: '<sheetname>'!A1:'<sheetname>'!B50 is not supported,Application,Calc,code,All,All,CLOSED,WONT_FIX,P5 (lowest),Normal
127608,Repeated copy-paste between search for and document seems to add or corrupt the character when it's an ATM emoji,Application,Writer,editing,PC,Windows 7,UNCONFIRMED,,P5 (lowest),Minor
127609,copying jpg together with text from word into writer causes graphic to not be displayed and copying it from writer causes crash,Application,Writer,editing,All,All,CLOSED,IRREPRODUCIBLE,P5 (lowest),Normal
127610,jpg quality lower after pasting from word compared to inserting via insert image,Application,Writer,editing,All,All,CLOSED,NOT_AN_OOO_ISSUE,P5 (lowest),Normal
127611,thickness of cell border lines are not saved fully as xls file,Application,Calc,save-export,Mac,OS X 10.10,CLOSED,DUPLICATE,P5 (lowest),Normal
127612,PIVOTTABLE: Copying a sheet with a pivot table copies the pivot table as data,Application,Calc,editing,All,All,CONFIRMED,,P5 (lowest),Normal
127613,freezing or error,Application,Calc,editing,PC,Windows 7,CLOSED,NOT_AN_OOO_ISSUE,P5 (lowest),Major
127614,Not able to ANCHOR an embedded picture in its place.,Application,Writer,formatting,Other,Windows 10,CLOSED,DUPLICATE,P5 (lowest),Normal
127615,Severe performance and memory issues,Application,Writer,configuration,All,All,CLOSED,IRREPRODUCIBLE,P5 (lowest),Critical
127616,"Cannot print address labels, due to crashing at random points",Application,Base,code,Mac,macOS 10.13,CLOSED,DUPLICATE,P5 (lowest),Normal
127617,Is there no spelling checker app v 4.1.4?,Application,Writer,editing,PC,Windows 10,CLOSED,NOT_AN_OOO_ISSUE,P5 (lowest),Normal
127618,Does not use my favorite font by default,Application,Calc,formatting,PC,Windows 10,CLOSED,IRREPRODUCIBLE,P5 (lowest),Normal
127619,"Opening large CSV file crashes Calc during ""Adapt row height""",Application,Calc,ui,All,All,CLOSED,IRREPRODUCIBLE,P5 (lowest),Normal
127620,"Open Office Writer immediately closes when I try to ""cut"" an image",Application,Writer,editing,PC,Windows 10,CLOSED,NOT_AN_OOO_ISSUE,P5 (lowest),Normal
127621,Update English dictionary to version 2017.11.01,Code,General,spell checking,All,All,RESOLVED,FIXED,P5 (lowest),Major
127622,"Issues being marked ""Solved"" not when they are solved from user's point of view, but when programmers don't care about the issue.",Code,General,ui,All,All,CLOSED,NOT_AN_OOO_ISSUE,P5 (lowest),Normal
127623,header prints nonprinting chars,Application,Writer,formatting,All,All,CLOSED,DUPLICATE,P5 (lowest),Minor
127624,Partially Cut&Pasting a line from a file to another corrupt an unrelated line,Application,Calc,editing,PC,Windows 10,CONFIRMED,,P2,Normal
127625,Error installing English dictionary extension,Application,Writer,open-import,PC,Windows 10,CLOSED,NOT_AN_OOO_ISSUE,P5 (lowest),Normal
127626,Format Painter,Application,Calc,formatting,All,macOS 10.13,CLOSED,IRREPRODUCIBLE,P5 (lowest),Normal
127627,AOO chokes on importing 24MB .odt document,Application,Writer,open-import,PC,Linux 64-bit,CLOSED,IRREPRODUCIBLE,P5 (lowest),Normal
127628,Lost adapted texts after switch to NSIS 3.x,Application,Installation,code,All,"Windows, all",RESOLVED,FIXED,P5 (lowest),Normal
127629,Locks up when formatting a picture,Application,Writer,editing,PC,Windows 10,CLOSED,DUPLICATE,P5 (lowest),Major
127630,Can't delete loaded extensions at all. Why? Where are the instructions on user accounts?,Application,Writer,code,PC,Windows 10,CLOSED,NOT_AN_OOO_ISSUE,P5 (lowest),Major
127631,Jump list file names are missing in Windows 10,Application,Writer,code,All,All,CLOSED,DUPLICATE,P5 (lowest),Normal
127632,ahhhah,Application,Writer,formatting,All,All,CLOSED,NOT_AN_OOO_ISSUE,P5 (lowest),Normal
127633,Copy pasting from OpenOffice/LibreOffice to Thunderbird ruins formatting,Application,Writer,editing,PC,Windows Vista,CLOSED,DUPLICATE,P5 (lowest),Normal
127634,Ctrl+Del removes content to the left of the cursor position,Application,Calc,editing,All,All,CLOSED,NOT_AN_OOO_ISSUE,P5 (lowest),Normal
127635,"To get away information about ""Don´t Reopen"" and ""Reopen""?",Code,General,ui,All,All,CLOSED,NOT_AN_OOO_ISSUE,P5 (lowest),Normal
