bugID,TextDescription,cl,pd,co,rp,OS,bs,rs,Priority,Severity
126372,Default and “Normal” Left and Right page margin values are not equal to displayed margin values.,Application,Writer,formatting,All,All,CLOSED,DUPLICATE,P5 (lowest),Minor
126373,Wrong transolation for Track changes/Record,NLC,Native-Lang,sv,All,All,CLOSED,NOT_AN_OOO_ISSUE,P5 (lowest),Minor
126375,"Can't print, can't open a file saved",Application,Writer,open-import,PC,Windows XP,CLOSED,NOT_AN_OOO_ISSUE,P5 (lowest),Normal
126376,SystemFilePicker getFiles() returns an incorrect list of files,Unclassified,App Dev,api,PC,Windows 7,CONFIRMED,,P5 (lowest),Normal
126377,Default SystemFilePicker setMultiSelectionMode is broken,Unclassified,App Dev,api,PC,Windows 7,CONFIRMED,,P5 (lowest),Normal
126378,constant crashes,Code,General,accessibility,PC,Windows 7,CLOSED,NOT_AN_OOO_ISSUE,P5 (lowest),Major
126379,Sidebar ‘Position and Size’ field validation can yield incorrect values. Unit conversion and validation occurring in the middle of keyboard entry – Inconsistent behavior.,Code,General,ui,All,All,UNCONFIRMED,,P5 (lowest),Normal
126380,impress does not use bullet set in slide master,Application,Impress,formatting,All,All,CONFIRMED,,P5 (lowest),Normal
126381,OO corrupts formulas when reading Excel spreadsheet,Application,Calc,open-import,PC,Windows 7,CONFIRMED,,P5 (lowest),Normal
126382,crashing open office 4.1.1 software Windows 7 x64,Code,General,help,PC,Windows 7,CLOSED,NOT_AN_OOO_ISSUE,P5 (lowest),Major
126383,columns width gets lost when changing page formatting,Application,Writer,formatting,All,All,UNCONFIRMED,,P5 (lowest),Normal
126384,"Edit->Fill is not only using cell content (e.g., numbers) but also the cell formatting (e.g., color)",Application,Calc,formatting,All,All,REOPENED,,P5 (lowest),Normal
126387,Opening signed documents with port 80 blocked result in freeze for several minutes,Application,Writer,ui,All,"Linux, all",UNCONFIRMED,,P5 (lowest),Major
126388,Macro library inside database not deleting,Application,Base,code,PC,Windows 7,CONFIRMED,,P5 (lowest),Normal
126389,"""dbt is missing"" affter saving as dbf",Application,Calc,save-export,PC,"Windows, all",CLOSED,NOT_AN_OOO_ISSUE,P5 (lowest),Critical
126390,Free version can't save documents with Mac OS X Yosemite,Application,Installation,update notifications,Mac,Other OS,CLOSED,NOT_AN_OOO_ISSUE,P5 (lowest),Critical
126391,race in using sdk api to set a fat border to a rectangle/range in a text table,Unclassified,App Dev,sdk,PC,Linux 64-bit,UNCONFIRMED,,P5 (lowest),Normal
126392,Check the Hierarchy for the   Dashboard Page,Unclassified,App Dev,api,All,All,CLOSED,NOT_AN_OOO_ISSUE,P5 (lowest),Normal
126393,Using Find Causes Crash,Application,Calc,editing,PC,"Windows 8, 8.1",CLOSED,NOT_AN_OOO_ISSUE,P5 (lowest),Critical
126394,Preview in Web Browser shows errrors,Application,Writer,viewing,PC,Windows 7,UNCONFIRMED,,P5 (lowest),Normal
126395,Unable to Add Extension from my E: drive,Application,Writer,open-import,PC,Windows 7,CLOSED,NOT_AN_OOO_ISSUE,P5 (lowest),Normal
126396,Frame Macro Generate JRE Defective Message,Application,Writer,ui,PC,Windows 7,CLOSED,NOT_AN_OOO_ISSUE,P5 (lowest),Normal
126397,Dictionary Problem,Code,General,spell checking,PC,"Windows 8, 8.1",CLOSED,DUPLICATE,P5 (lowest),Critical
126398,"Empty text-boxes in exported HTML (from impress) render self-closed DIV, leading to matryoshka-doll-like nested pages",Application,Impress,save-export,Mac,OS X 10.9,UNCONFIRMED,,P5 (lowest),Normal
126399,Open Office won't open .doc files,Application,Base,help,PC,"Windows 8, 8.1",CLOSED,NOT_AN_OOO_ISSUE,P5 (lowest),Normal
126400,Font list: Hidden fonts all showing up,Code,General,ui,PC,Windows 7,CLOSED,DUPLICATE,P5 (lowest),Normal
126401,Add ASF license headers to files,Code,General,legal,All,All,CONFIRMED,,P5 (lowest),Normal
126402,Pressing Ctrl-A within a cell removes the formula coloring,Application,Calc,editing,All,Linux 64-bit,CONFIRMED,,P5 (lowest),Normal
126403,"After every slide I create, the presentation crashes and require a recovery. Will not let me add more slides (only have 8)",Application,Impress,editing,All,All,CLOSED,NOT_AN_OOO_ISSUE,P5 (lowest),Normal
126404,Lost precision when copying table data,Application,Base,code,All,Windows 7,CLOSED,NOT_AN_OOO_ISSUE,P5 (lowest),Normal
126405,Insert->Indexes & Tables Cannot Handle Short Form Legal Citation,Application,Writer,editing,All,All,CLOSED,DUPLICATE,P5 (lowest),Minor
126406,extensions.openoffice.org website is down,Infrastructure,Infrastructure,Website general issues,All,All,CLOSED,NOT_AN_OOO_ISSUE,P3,Normal
126407,"the program crashes when you are using the font ""Old Standard"" in the Table of Contents",Application,Writer,formatting,All,All,UNCONFIRMED,,P5 (lowest),Normal
126408,Open office freezes after ~5 minutes of operation,Code,General,ui,All,OS X 10.9,CLOSED,NOT_AN_OOO_ISSUE,P5 (lowest),Normal
126409,JRE,Code,General,code,All,All,CLOSED,NOT_AN_OOO_ISSUE,P5 (lowest),Normal
126411,bad import CSV files with text delimiters,Application,Calc,open-import,PC,Linux 64-bit,CLOSED,NOT_AN_OOO_ISSUE,P5 (lowest),Normal
126412,"Suggestion: Add ""Copy with full precision"" for Base tables",Application,Base,code,All,Windows 7,UNCONFIRMED,,P5 (lowest),Normal
126414,missing -fPIC flag,Code,General,code,PC,"Linux, all",UNCONFIRMED,,P5 (lowest),Normal
126415,Access to d/l templates or Website Feedback produces same error msg.,Infrastructure,Infrastructure,Website general issues,All,All,CLOSED,DUPLICATE,P5 (lowest),Normal
126416,Append table alias name Database Advanced Settings overriden by database metadata from JDBC data source,Application,Base,code,All,All,CLOSED,NOT_AN_OOO_ISSUE,P5 (lowest),Normal
126417,"4.1.1  In Times New Roman, there isn't a a letter l (el)",Application,Writer,formatting,Mac,OS X 10.10,CLOSED,NOT_AN_OOO_ISSUE,P5 (lowest),Normal
126418,All words (except those in caps) in all documents are showing up as misspelled,Code,Build Tools,code,All,All,CLOSED,DUPLICATE,P5 (lowest),Normal
126419,Export to PDF loses transparency,Application,Draw,save-export,PC,Windows 7,CLOSED,DUPLICATE,P5 (lowest),Normal
126420,Format Numbering - .1 instead of 1.,Application,Writer,formatting,PC,Windows XP,CLOSED,NOT_AN_OOO_ISSUE,P5 (lowest),Normal
126421,openoffice does not recognize the incoding of txt files.,Application,Writer,open-import,All,"Windows, all",UNCONFIRMED,,P5 (lowest),Major
126422,Document opens encrypted/illegible,Application,Writer,open-import,PC,Windows 7,CLOSED,NOT_AN_OOO_ISSUE,P5 (lowest),Major
126423,openoffice does not save document files as docx formats and in openning them is very slow.,Application,Writer,save-export,All,"Windows, all",CLOSED,DUPLICATE,P5 (lowest),Normal
126424,HTML invalid after extra ID and CLASS attributes added,Application,Impress,save-export,Mac,"Mac OS X, all",CLOSED,NOT_AN_OOO_ISSUE,P5 (lowest),Normal
126425,tool bar issues,Code,General,ui,All,All,CLOSED,NOT_AN_OOO_ISSUE,P5 (lowest),Normal
126426,Cant open my spreadsheet,Application,Calc,open-import,All,All,CLOSED,NOT_AN_OOO_ISSUE,P5 (lowest),Normal
126427,Problems with crashing.,Application,Draw,help,PC,Windows 7,CLOSED,NOT_AN_OOO_ISSUE,P5 (lowest),Normal
126428,there is no shortcut to go to the next and previous page.,Application,Writer,ui,All,"Windows, all",CLOSED,NOT_AN_OOO_ISSUE,P5 (lowest),Major
126429,problem with diacritics in persian and arabic language.,Application,Writer,editing,All,All,CONFIRMED,,P5 (lowest),Major
126430,display page number in writer sometimes is very different with page number in microsoft word.,Application,Writer,formatting,All,All,CLOSED,NOT_AN_OOO_ISSUE,P5 (lowest),Major
126431,"find and replace character, word, sentence etc has the same key and not easy and not like microsoft word and libreoffice writer.",Application,Writer,editing,All,All,CLOSED,NOT_AN_OOO_ISSUE,P5 (lowest),Major
126432,Open Office Crashes ALL the time opening this document,Application,Writer,open-import,PC,"Windows 8, 8.1",CLOSED,IRREPRODUCIBLE,P5 (lowest),Critical
126433,Word Count tool is not working correctly,Application,Writer,programming,PC,Windows 7,CLOSED,IRREPRODUCIBLE,P5 (lowest),Normal
126434,When trying to save a file the program hangs until I have to force quite.,Application,Writer,save-export,Mac,"Mac OS X, all",CLOSED,NOT_AN_OOO_ISSUE,P5 (lowest),Normal
126435,Consistent incorrect results from many CELL() functions,Application,Calc,programming,PC,Windows 7,CLOSED,NOT_AN_OOO_ISSUE,P5 (lowest),Major
126436,scaling OOWriter in Windows 10,Application,Writer,viewing,PC,Windows 10,CONFIRMED,,P5 (lowest),Normal
126437,Rectangles viewed in wrong position on page-boarders,Application,Writer,viewing,PC,Windows 10,CLOSED,NOT_AN_OOO_ISSUE,P5 (lowest),Normal
126438,Seemingly random crash,Code,General,code,Mac,OS X 10.9,CLOSED,NOT_AN_OOO_ISSUE,P5 (lowest),Normal
126439,OO Hangs within OS X 10.11 (beta 3),Code,General,ui,Mac,OS X 10.10,CLOSED,NOT_AN_OOO_ISSUE,P2,Major
126440,Editing of Formula TRANSPOSE impossible,Application,Calc,programming,All,All,UNCONFIRMED,,P5 (lowest),Normal
126441,"[RFE]: Insert-Function shows 'Last used', and when clicked actually shows last used as default",Application,Calc,editing,All,All,CLOSED,DUPLICATE,P5 (lowest),Trivial
126442,Calc loses the existing sheet when trying to open the next .csv file,Application,Calc,open-import,PC,Windows 7,CLOSED,NOT_AN_OOO_ISSUE,P5 (lowest),Normal
126445,OpenOffice crashes on  64 bit systems when it tries to open sqlite3 table created with ODBC driver,Application,Base,code,All,All,RESOLVED,FIXED,P2,Major
126446,"Read-Error  Format error discovered in the file in sub-document content.xml at 2,3517(row,col)",Application,Writer,formatting,PC,Windows 7,CLOSED,FIXED,P5 (lowest),Normal
126447,"When using LanguageTools, toggling the checkbox ""check grammar"" in the spell checker removes content",Application,Writer,code,All,All,CLOSED,FIXED,P2,Major
126448,AOO Version 4.1.1 not opening MSWord97-2003 document,Application,Writer,viewing,PC,Windows 7,CLOSED,IRREPRODUCIBLE,P5 (lowest),Normal
126449,building standard trunk fails on module svx,Code,Build Tools,GNU make,All,All,CLOSED,OBSOLETE,P5 (lowest),Normal
126450,Built in language has forgotten settings,Application,Writer,programming,PC,"Windows, all",CLOSED,NOT_AN_OOO_ISSUE,P5 (lowest),Trivial
126451,please check the issue,Code,General,chart,PC,All,CLOSED,NOT_AN_OOO_ISSUE,P5 (lowest),Normal
126453,system will open but not able to use.,Code,General,accessibility,Mac,"Mac OS X, all",CLOSED,NOT_AN_OOO_ISSUE,P5 (lowest),Normal
126454,Update English dictionary to version 2015.08.01,Code,General,spell checking,All,All,CLOSED,FIXED,P3,Blocker
126456,"splash page missing text, buttons with no text, menus with no text",Application,Installation,ui,Mac,OS X 10.10,CLOSED,NOT_AN_OOO_ISSUE,P5 (lowest),Blocker
126457,Mac accent menu missing,Application,Writer,editing,Mac,"Mac OS X, all",UNCONFIRMED,,P5 (lowest),Major
126458,blurry fonts and display,Application,Writer,viewing,PC,Windows 10,CONFIRMED,,P5 (lowest),Trivial
126459,freezes when I try to click a hyperlink,Application,Writer,help,PC,"Windows 8, 8.1",CLOSED,FIXED,P5 (lowest),Trivial
126460,Wrong line numbers produces errors,Application,Calc,editing,All,Windows 10,CLOSED,NOT_AN_OOO_ISSUE,P5 (lowest),Critical
126462,Non-printing character scrambled with hanging punctuation,Application,Writer,formatting,All,All,UNCONFIRMED,,P5 (lowest),Normal
126463,Only western font of symbol character is set when reading doc files,Application,Writer,open-import,All,All,UNCONFIRMED,,P5 (lowest),Normal
126464,Windows 10 Upgrade Interference with OpenOffice,Application,Installation,ui,All,All,CLOSED,OBSOLETE,P5 (lowest),Normal
126465,Add vertical positioning as per the golden ratio for frames,Application,Writer,formatting,All,All,UNCONFIRMED,,P5 (lowest),Normal
126466,Random blank pages appearing in master document,Application,Writer,formatting,PC,Linux 64-bit,CLOSED,IRREPRODUCIBLE,P5 (lowest),Normal
126467,ods format does not retain content,Application,Calc,open-import,All,All,UNCONFIRMED,,P5 (lowest),Normal
126468,Calc crashed when deleting object with macro (BASIC),Application,Calc,editing,All,All,CLOSED,DUPLICATE,P5 (lowest),Normal
126469,Failing checksums in ./bootstrap due to archive decompression,Code,Build Tools,external prerequisites,All,All,RESOLVED,FIXED,P3,Normal
126470,Proposed changes to Bulgarian locale bg_BG.xml,Code,Internationalization,localedata,All,All,REOPENED,,P4,Normal
126471,what does it mean when you get a pop up saying soffice.bin - Entry Point Not Found?,Application,Base,help,PC,All,CLOSED,NOT_AN_OOO_ISSUE,P5 (lowest),Major
126472,unable to dowbload programme,Infrastructure,Infrastructure,Downloads,All,All,CLOSED,NOT_AN_OOO_ISSUE,P3,Normal
126473,I used up 3.2G of data when openoffice crashes several times while editing.,Application,Writer,editing,PC,Windows 10,CLOSED,NOT_AN_OOO_ISSUE,P5 (lowest),Trivial
126474,Allow symbols in docx files to be imported,Application,Writer,open-import,All,All,CLOSED,NOT_AN_OOO_ISSUE,P5 (lowest),Normal
126475,All words being labelled as misspelled,Application,Writer,editing,PC,Windows 7,CLOSED,DUPLICATE,P5 (lowest),Normal
126476,Set Firstline Auto Indent to 2 Chars for Chinese,Application,Writer,formatting,All,All,RESOLVED,FIXED,P5 (lowest),Normal
126477,How to recover my lost data (during lightning storm),Code,General,help,PC,Windows 7,CLOSED,NOT_AN_OOO_ISSUE,P5 (lowest),Normal
126478,How to recover my lost data (during lightning storm),Code,General,help,PC,Windows 7,CLOSED,DUPLICATE,P5 (lowest),Normal
126479,"Read error, Format error discovered in the file in sub-document content.xml at 2,2992(row,col)",Application,Writer,formatting,All,All,CLOSED,DUPLICATE,P5 (lowest),Normal
126480,Update meta data for OpenOffice 4.1.2,Code,General,code,All,All,CLOSED,FIXED,P3,Normal
126482,files open in read only,Code,General,ui,PC,Windows 10,REOPENED,,P5 (lowest),Normal
126483,Table of contents is not accurate,Application,Writer,editing,PC,"Windows, all",CLOSED,NOT_AN_OOO_ISSUE,P5 (lowest),Normal
126484,Tab leader not visible,Application,Draw,formatting,All,Linux 32-bit,CLOSED,NOT_AN_OOO_ISSUE,P5 (lowest),Normal
126486,Lines in diagram move unpredictably when starting editing or other lines moved,Application,Writer,ui,PC,Windows 7,CLOSED,NOT_AN_OOO_ISSUE,P5 (lowest),Normal
126487,Showstopper stability issue meets showstopper usability issue,Application,Writer,code,All,All,CLOSED,IRREPRODUCIBLE,P5 (lowest),Normal
126488,ALT-I-H fails to copy target text from source. Replaces text on doc with target value text.,Application,Writer,editing,All,All,CLOSED,NOT_AN_OOO_ISSUE,P5 (lowest),Normal
126489,When scrolling it crashes,Application,Impress,viewing,PC,Windows 7,CLOSED,NOT_AN_OOO_ISSUE,P5 (lowest),Critical
126490,"create line chart, save and exit; reopen chart; edit loses all chart data",Application,Calc,editing,All,All,UNCONFIRMED,,P5 (lowest),Major
126491,Sudden problems with auto spell check,Application,Writer,editing,PC,Windows 10,CLOSED,DUPLICATE,P5 (lowest),Normal
126492,Spell Checker doesn't recognise any words,Application,Writer,editing,PC,Windows XP,CLOSED,DUPLICATE,P5 (lowest),Normal
126493,Inserting Pictures,Application,Impress,editing,PC,Windows 7,CLOSED,DUPLICATE,P5 (lowest),Normal
126494,Calc crash on opening complex .xls file,Application,Calc,open-import,PC,Windows 10,CLOSED,NOT_AN_OOO_ISSUE,P5 (lowest),Major
126495,Update English dictionary to version 2015.09.01,Code,General,spell checking,All,All,CLOSED,FIXED,P3,Blocker
126496,slide deleted and shifted,Application,Impress,ui,All,All,CLOSED,NOT_AN_OOO_ISSUE,P5 (lowest),Normal
126497,Word docx file formatted incorrectly,Application,Writer,formatting,PC,Windows XP,CLOSED,DUPLICATE,P5 (lowest),Normal
126498,INSERTED IMAGES ONLY VISIBLE IN PRINT PREVIEW,Application,Writer,viewing,Mac,Mac OS X 10.7,CLOSED,NOT_AN_OOO_ISSUE,P5 (lowest),Normal
126499,Cache Default Password for use with Password-Protected Files,Code,General,security,All,All,UNCONFIRMED,,P5 (lowest),Normal
126500,ASCII Filter Options Menu Appears and Shuts Down Open Office,Unclassified,App Dev,scripting,PC,Windows 10,CLOSED,NOT_AN_OOO_ISSUE,P5 (lowest),Trivial
126501,™2013,Application,Base,code,All,All,CLOSED,NOT_AN_OOO_ISSUE,P5 (lowest),Minor
126502,Open documents of same type basic runtime error,Unclassified,App Dev,scripting,All,All,CLOSED,NOT_AN_OOO_ISSUE,P5 (lowest),Normal
126503,Input field with chinese charactor has incorrect newline codes when saved as MS Word,Application,Writer,save-export,PC,Windows 7,UNCONFIRMED,,P5 (lowest),Normal
126504,wish: image compression,Application,Writer,formatting,All,"Windows 8, 8.1",CLOSED,DUPLICATE,P5 (lowest),Normal
126505,TOC automatic with links to content,Application,Writer,formatting,All,All,CLOSED,DUPLICATE,P5 (lowest),Normal
126506,column limit,Application,Calc,formatting,All,All,CLOSED,DUPLICATE,P5 (lowest),Normal
126507,read-only documents,Application,Writer,help,All,All,CLOSED,NOT_AN_OOO_ISSUE,P5 (lowest),Normal
126508,Not able to see keyboard with open office,Code,General,accessibility,All,All,UNCONFIRMED,,P5 (lowest),Normal
126509,Copy/Paste toward other software increase the line spacing,Application,Writer,save-export,PC,Windows 7,CLOSED,NOT_AN_OOO_ISSUE,P5 (lowest),Major
126510,UNO API LibreOffice Writer Process hang / freeze C#,Unclassified,App Dev,api,All,All,CLOSED,NOT_AN_OOO_ISSUE,P5 (lowest),Normal
126511,Bolded text in between elements of numbered list causes numbers to become bold upon close & reopen of file,Application,Writer,formatting,PC,"Windows, all",CLOSED,DUPLICATE,P5 (lowest),Normal
126512,export directly to PDF,Application,Impress,save-export,PC,Windows 10,CLOSED,NOT_AN_OOO_ISSUE,P5 (lowest),Normal
126513,Cannot update a atext file containing pictures once it has been saved as word document,Application,Writer,editing,PC,Windows 10,CLOSED,NOT_AN_OOO_ISSUE,P5 (lowest),Normal
126514,Top half of wizard window appears off screen when using dual monitor setup,Application,Writer,configuration,PC,Windows 7,CONFIRMED,,P5 (lowest),Normal
126516,TYPE() formula help doesn't document  value 64 for arrays,Application,Calc,help,All,All,RESOLVED,FIXED,P5 (lowest),Normal
126517,Formulea wont copy and paste formula.  It pastes data value into cell,Application,Calc,editing,PC,Windows 10,CLOSED,NOT_AN_OOO_ISSUE,P5 (lowest),Normal
126518,Build of OS/2 tree,Code,General,code,All,OS/2,CONFIRMED,,P5 (lowest),Normal
126519,Some wrong function names written to ODS (according to OpenFormula spec),Application,Calc,save-export,All,All,CONFIRMED,,P5 (lowest),Normal
126521,edits on one sh,Application,Calc,editing,All,"Linux, all",CLOSED,IRREPRODUCIBLE,P5 (lowest),Normal
126523,sort does not remember language,Application,Calc,editing,All,"Linux, all",CLOSED,NOT_AN_OOO_ISSUE,P5 (lowest),Normal
126524,case-sensitive InStr macro function does not work,Application,Calc,programming,All,"Linux, all",CLOSED,DUPLICATE,P5 (lowest),Normal
126525,Every word is wrong,Application,Writer,editing,All,All,CLOSED,DUPLICATE,P5 (lowest),Major
126526,Loaded styles not present on file re-open,Application,Writer,formatting,PC,Windows 7,CLOSED,NOT_AN_OOO_ISSUE,P5 (lowest),Normal
126528,Window doesn't close and I have to shut down and lose work,Unclassified,App Dev,api,All,All,CLOSED,NOT_AN_OOO_ISSUE,P5 (lowest),Normal
126529,Bullet should be apart of AccessibleText,Application,Writer,code,All,All,RESOLVED,FIXED,P5 (lowest),Normal
126530,Last line of document disappears when opened in MS Word 2013,Application,Writer,viewing,PC,"Windows, all",CONFIRMED,,P5 (lowest),Major
126531,"different behaviour for ""CharColor"" and ""CharBackColor"" properties in java",Unclassified,App Dev,api,PC,Windows 10,UNCONFIRMED,,P5 (lowest),Normal
126532,Background tab not accessible,Application,Writer,ui,PC,"Linux, all",CLOSED,IRREPRODUCIBLE,P5 (lowest),Normal
126533,Slide Presentation on 5th slide get an SEH Exception Access Violation,Application,Impress,viewing,All,Windows 10,CLOSED,DUPLICATE,P5 (lowest),Critical
126534,program closes,Application,Calc,ui,PC,Windows 7,CLOSED,NOT_AN_OOO_ISSUE,P5 (lowest),Normal
126535,Evelope Printing,Application,Writer,printing,PC,All,CLOSED,NOT_AN_OOO_ISSUE,P5 (lowest),Normal
126539,41118,Application,Writer,printing,PC,Windows 7,CLOSED,NOT_AN_OOO_ISSUE,P5 (lowest),Normal
126541,Remove dependency on Google Code for 4.1.2 builds,Code,Build Tools,external prerequisites,All,All,CLOSED,FIXED,P5 (lowest),Normal
126542,UI glitches while trying to add or remove colour from the option menu's colour section,Application,Calc,ui,PC,Windows 10,UNCONFIRMED,,P5 (lowest),Major
126543,Calc frequently becomes nonresponsive after rapid sequential paste (ctrl+v) operations,Application,Calc,editing,PC,Windows 7,CLOSED,NOT_AN_OOO_ISSUE,P5 (lowest),Normal
126544,calc hangs with spinning icon when restoring after being minimized,Application,Calc,ui,Mac,OS X 10.9,CLOSED,NOT_AN_OOO_ISSUE,P5 (lowest),Normal
126545,AOO 4.0.1 crash : a little french sentence make crash all the AOO,Application,Writer,ui,PC,"Windows 8, 8.1",CLOSED,IRREPRODUCIBLE,P5 (lowest),Minor
126546,large calc file does not open,Application,Calc,open-import,PC,Windows 10,CLOSED,NOT_AN_OOO_ISSUE,P5 (lowest),Critical
126548,Sidebar in Draw,Application,Draw,ui,PC,Windows 7,CLOSED,WONT_FIX,P5 (lowest),Minor
126549,delete row when freeze if set only deletes non-frozen cells,Application,Calc,editing,PC,Windows XP,UNCONFIRMED,,P5 (lowest),Normal
126550,full CYMK image support Feature Request,Application,Writer,editing,All,All,CLOSED,DUPLICATE,P5 (lowest),Normal
126551,Plugin Manager,Application,Impress,editing,PC,Windows 10,CLOSED,DUPLICATE,P5 (lowest),Critical
126552,Occasional duplication of the final line in the data source browser when importing into calc via COPY,Application,Calc,open-import,All,All,CONFIRMED,,P3,Normal
126553,Port FreeBSD build enhancements,Code,Build Tools,code,All,All,CLOSED,FIXED,P5 (lowest),Normal
126554,Install: Error 1406,Application,Base,help,PC,Windows 10,CLOSED,NOT_AN_OOO_ISSUE,P5 (lowest),Trivial
126555,unnecessary redisplay,Application,Writer,editing,PC,Windows XP,UNCONFIRMED,,P5 (lowest),Normal
126556,Word wrap text not fitting row heights after saving and opening.,Application,Calc,formatting,PC,Windows 10,CLOSED,IRREPRODUCIBLE,P5 (lowest),Normal
126557,Formula wizard: increase number of lines of dropdown of category listbox,Application,Calc,ui,All,All,RESOLVED,FIXED,P5 (lowest),Minor
126558,End notes does not appear in document,Application,Writer,open-import,Mac,OS X 10.9,CLOSED,NOT_AN_OOO_ISSUE,P5 (lowest),Normal
126559,Openoffice not in list of programs in control panel uninstall,Application,Installation,ui,PC,Windows 10,CLOSED,NOT_AN_OOO_ISSUE,P5 (lowest),Trivial
126560,####,Application,Writer,viewing,All,All,CLOSED,NOT_AN_OOO_ISSUE,P5 (lowest),Normal
126561,Spell Check Failing To Correctly Identify Spelled Word,Application,Writer,editing,PC,Windows 7,CLOSED,DUPLICATE,P5 (lowest),Normal
126562,Repeated loaded records on large editable tables or queries,Application,Base,code,PC,Windows 10,UNCONFIRMED,,P5 (lowest),Normal
126563,Broken links after renaming tables/queries used in queries,Application,Base,code,PC,Windows 10,CLOSED,NOT_AN_OOO_ISSUE,P5 (lowest),Minor
126564,Base crashes when attached to remote db over night.,Application,Base,code,PC,Windows 7,CLOSED,NOT_AN_OOO_ISSUE,P5 (lowest),Minor
126565,error opening xls file (just hang),Application,Calc,open-import,PC,Windows 7,CLOSED,DUPLICATE,P5 (lowest),Critical
126567,Update copyright year,Code,General,legal,All,All,CLOSED,FIXED,P5 (lowest),Normal
126569,"Multi User serving MYSQL to Base Reports not Locking to user ""ThisDatabaseDocument""",Application,Base,code,All,All,CLOSED,NOT_AN_OOO_ISSUE,P5 (lowest),Normal
126571,"""Restore",Application,Writer,open-import,Mac,"Mac OS X, all",CLOSED,NOT_AN_OOO_ISSUE,P3,Normal
126572,Update OpenSSL to 0.9.8zg,Code,Build Tools,external prerequisites,All,All,CLOSED,FIXED,P5 (lowest),Normal
126573,Update English dictionary to version 2015.10.01,Code,General,spell checking,All,All,CLOSED,FIXED,P3,Blocker
126574,Install dictionary OOo 4.1.1 on Windows10 = crash,Application,Installation,ui,PC,Other OS,CLOSED,NOT_AN_OOO_ISSUE,P5 (lowest),Trivial
126575,Changing font info in outline causes entire section to change,Application,Writer,formatting,PC,"Windows, all",UNCONFIRMED,,P5 (lowest),Normal
126576,Banner that I can't close,Infrastructure,Infrastructure,Downloads,Mac,OS X 10.10,CLOSED,NOT_AN_OOO_ISSUE,P5 (lowest),Normal
126577,"Java pop up ""you need to install the Java Runtime Environment"" keeps popping up",Application,Writer,editing,Mac,"Mac OS X, all",UNCONFIRMED,,P5 (lowest),Major
126578,Update configure.in from trunk's configure.ac,Code,Build Tools,configure,All,All,CLOSED,FIXED,P5 (lowest),Normal
126579,Update set_soenv.in from trunk,Code,Build Tools,solenv,All,All,CLOSED,FIXED,P5 (lowest),Normal
126580,Label creation not working,Unclassified,App Dev,api,All,"Windows, all",CLOSED,NOT_AN_OOO_ISSUE,P5 (lowest),Normal
126581,Calc Crashes often get allocation error,Application,Calc,save-export,PC,"Windows 8, 8.1",CLOSED,NOT_AN_OOO_ISSUE,P5 (lowest),Normal
126582,When trying to access a read/only share on Sharepoint an error is shown,Code,General,code,All,"Windows, all",CLOSED,FIXED,P5 (lowest),Blocker
126583,O.O. application will not open,Application,Base,code,All,Windows 10,CLOSED,NOT_AN_OOO_ISSUE,P5 (lowest),Normal
126584,spreadsheet frozen,Application,Calc,editing,PC,"Windows 8, 8.1",CLOSED,NOT_AN_OOO_ISSUE,P5 (lowest),Trivial
126585,Apache Open Office crashes when high contrast turn on,Code,General,ui,PC,Windows 7,CLOSED,OBSOLETE,P5 (lowest),Normal
126586,automation deadlock: osl_closeSocket() doesn't wake up thread stuck in accept(),Code,General,code,All,FreeBSD,CLOSED,FIXED,P5 (lowest),Normal
